{
  "id": "D",
  "evidence_strength": "Moderate",
  "chronology_clarity": "High",
  "governance_relevance": "Low",
  "operational_impact": "Low",
  "actionability": "Low",
  "priority_tier": "Tier 0 — no issue",
  "next_action": "Close. Absence accounted for by authorised disposal; record the certificate reference.",
  "rationale": "An authorising instrument is present and verified, so the observation is accounted for."
}
